[
  {
    "id": 1,
    "name": "Whispering Antechamber",
    "difficulty": "Easy",
    "threats": [
      "Rat Swarm",
      "Giant Centipede"
    ],
    "history": "Once a greeting hall to a forgotten guild.",
    "flavor": "Soft murmurs ride the dust as if the walls are practicing your name.",
    "discoverables": [
      "Leather Pouch",
      "Hidden Nook"
    ],
    "tags": [
      "event",
      "lore"
    ],
    "mechanics": {
      "on_enter": {
        "crit_bonus": 0.02
      },
      "on_clear": {
        "item": "Cracked Map Scrap"
      }
    }
  },
  {
    "id": 2,
    "name": "Mosslight Grotto",
    "difficulty": "Easy",
    "threats": [
      "Cave Salamander",
      "Glowspores"
    ],
    "history": "A collapsed well chamber fed by an underground spring.",
    "flavor": "Bioluminescent moss paints your boots green.",
    "discoverables": [
      "Dusty Chest",
      "Old Crate"
    ],
    "tags": [
      "environment",
      "rest"
    ],
    "mechanics": {
      "on_enter": {
        "heal": 8
      },
      "on_clear": {
        "gold_flat": 2
      }
    }
  },
  {
    "id": 3,
    "name": "Abandoned Guard Post",
    "difficulty": "Easy",
    "threats": [
      "Rabid Dog",
      "Sleepy Goblin"
    ],
    "history": "Last held during the Siege of Ironsky.",
    "flavor": "A dented helm still sits at attention on a spear.",
    "discoverables": [
      "Hidden Nook",
      "Hidden Nook"
    ],
    "tags": [
      "lore",
      "trap"
    ],
    "mechanics": {
      "hazard": "Rust Trap",
      "on_clear": {
        "item": "Old Key"
      }
    }
  },
  {
    "id": 4,
    "name": "Dice-etched Alcove",
    "difficulty": "Easy",
    "threats": [
      "Stone Beetle",
      "Cave Cricket"
    ],
    "history": "Gamblers carved odds into the stone to \u00e2\u20ac\u02dctilt fate.\u00e2\u20ac\u2122",
    "flavor": "Numerals and pips swirl into lucky spirals.",
    "discoverables": [
      "Dusty Chest",
      "Weapon Rack"
    ],
    "tags": [
      "lore",
      "puzzle"
    ],
    "mechanics": {
      "on_enter": {
        "crit_bonus": 0.01
      },
      "on_clear": {
        "item": "Lucky Chip"
      }
    }
  },
  {
    "id": 5,
    "name": "Lantern Row",
    "difficulty": "Easy",
    "threats": [
      "Shadow Imp",
      "Soot Sprite"
    ],
    "history": "Miners lined their path here to count shifts.",
    "flavor": "Lanterns sputter in sequence, like a heartbeat.",
    "discoverables": [
      "Leather Pouch",
      "Wooden Barrel"
    ],
    "tags": [
      "environment"
    ],
    "mechanics": {
      "on_enter": {
        "extra_rolls": 1
      },
      "on_fail": {
        "status": "soot-choke"
      }
    }
  },
  {
    "id": 6,
    "name": "Scribe's Niche",
    "difficulty": "Easy",
    "threats": [
      "Book Mite",
      "Startled Bat"
    ],
    "history": "A clerk hid tax ledgers from a corrupt baron.",
    "flavor": "The ink still smells faintly of vinegar.",
    "discoverables": [
      "Hidden Nook",
      "Old Crate"
    ],
    "tags": [
      "event",
      "lore"
    ],
    "mechanics": {
      "on_clear": {
        "item": "Old Key"
      }
    }
  },
  {
    "id": 7,
    "name": "Pilgrim's Rest",
    "difficulty": "Easy",
    "threats": [
      "Dozing Slime",
      "Lurking Spider"
    ],
    "history": "Travelers once doled bread and stories here.",
    "flavor": "Someone embroidered a crude sun on a pillow.",
    "discoverables": [
      "Supply Cabinet",
      "Burial Niche"
    ],
    "tags": [
      "rest"
    ],
    "mechanics": {
      "on_enter": {
        "heal": 10
      }
    }
  },
  {
    "id": 104,
    "name": "Forgotten Armory",
    "difficulty": "Easy",
    "threats": [
      "Rust Monster",
      "Web Spider"
    ],
    "history": "Weapons meant for a war that never came.",
    "flavor": "Dust dances in shafts of light through cracked stone.",
    "discoverables": [
      "Wooden Barrel",
      "Wooden Barrel"
    ],
    "tags": [
      "combat",
      "environment"
    ],
    "mechanics": {
      "on_clear": {
        "item": "Old Key"
      }
    }
  },
  {
    "id": 105,
    "name": "Honey Cellar",
    "difficulty": "Easy",
    "threats": [
      "Agitated Bees",
      "Angry Swarm"
    ],
    "history": "Beekeepers stored winter reserves here.",
    "flavor": "The air tastes golden and thick.",
    "discoverables": [
      "Dusty Chest",
      "Old Crate"
    ],
    "tags": [
      "environment",
      "rest"
    ],
    "mechanics": {
      "on_clear": {
        "item": "Old Key"
      }
    }
  },
  {
    "id": 106,
    "name": "Merchant's Cache",
    "difficulty": "Easy",
    "threats": [
      "Pack Rat",
      "Startled Rat"
    ],
    "history": "A trader's emergency stash, long forgotten.",
    "flavor": "Someone carved 'FOR LEAN TIMES' into the wall.",
    "discoverables": [
      "Dusty Chest",
      "Dusty Chest"
    ],
    "tags": [
      "event"
    ],
    "mechanics": {
      "on_clear": {
        "item": "Old Key"
      }
    }
  },
  {
    "id": 107,
    "name": "Apprentice Workshop",
    "difficulty": "Easy",
    "threats": [
      "Wood Termites",
      "Tool Gremlin"
    ],
    "history": "Where young craftsmen learned their trade.",
    "flavor": "Half-finished projects sit waiting for hands that won't return.",
    "discoverables": [
      "Old Crate",
      "Leather Pouch"
    ],
    "tags": [
      "environment"
    ],
    "mechanics": {
      "on_clear": {
        "item": "Lockpick Kit"
      }
    }
  },
  {
    "id": 108,
    "name": "Wine Storage",
    "difficulty": "Easy",
    "threats": [
      "Glass Wasp",
      "Drunk Sprite"
    ],
    "history": "The castle's finest vintages aged in darkness.",
    "flavor": "Spilled wine stains the floor like old blood.",
    "discoverables": [
      "Dusty Chest",
      "Dusty Chest"
    ],
    "tags": [
      "environment",
      "rest"
    ],
    "mechanics": {
      "on_enter": {
        "heal": 5
      },
      "on_clear": {
        "gold_flat": 3
      }
    }
  },
  {
    "id": 109,
    "name": "Crystal Shrine",
    "difficulty": "Easy",
    "threats": [
      "Light Wisp",
      "Praying Mantis"
    ],
    "history": "Travelers left offerings for safe passage.",
    "flavor": "Crystals hum with faint, forgotten prayers.",
    "discoverables": [
      "Iron Lockbox",
      "Dusty Chest"
    ],
    "tags": [
      "event",
      "rest"
    ],
    "mechanics": {
      "on_clear": {
        "item": "Old Key"
      }
    }
  },
  {
    "id": 110,
    "name": "Servant's Quarters",
    "difficulty": "Easy",
    "threats": [
      "Poltergeist",
      "Bitter Ghost"
    ],
    "history": "Where the castle's staff rested between duties.",
    "flavor": "Personal effects lie scattered as if the owners just stepped out.",
    "discoverables": [
      "Leather Pouch",
      "Wooden Barrel"
    ],
    "tags": [
      "environment"
    ],
    "mechanics": {
      "on_clear": {
        "item": "Old Key"
      }
    }
  },
  {
    "id": 111,
    "name": "Root Cellar",
    "difficulty": "Easy",
    "threats": [
      "Spore Beetle",
      "Vine Creeper"
    ],
    "history": "Preserved foods sustained the castle through sieges.",
    "flavor": "The earthy smell is oddly comforting.",
    "discoverables": [
      "Dusty Chest",
      "Wooden Barrel"
    ],
    "tags": [
      "environment",
      "rest"
    ],
    "mechanics": {
      "on_clear": {
        "item": "Antivenom Leaf"
      }
    }
  },
  {
    "id": 112,
    "name": "Stable Ruins",
    "difficulty": "Easy",
    "threats": [
      "Giant Flea",
      "Spooked Horse Spirit"
    ],
    "history": "Where warhorses rested between campaigns.",
    "flavor": "Horseshoes still hang on rusted nails.",
    "discoverables": [
      "Dusty Chest",
      "Leather Pouch"
    ],
    "tags": [
      "environment"
    ],
    "mechanics": {
      "on_clear": {
        "gold_flat": 3
      }
    }
  },
  {
    "id": 113,
    "name": "Baker's Oven",
    "difficulty": "Easy",
    "threats": [
      "Fire Beetle",
      "Ash Elemental"
    ],
    "history": "Bread fed an army; the ovens never cooled.",
    "flavor": "The scent of phantom loaves lingers.",
    "discoverables": [
      "Supply Cabinet",
      "Leather Pouch"
    ],
    "tags": [
      "environment",
      "rest"
    ],
    "mechanics": {
      "on_enter": {
        "heal": 6
      },
      "on_clear": {
        "gold_flat": 2
      }
    }
  },
  {
    "id": 114,
    "name": "Laundry Pit",
    "difficulty": "Easy",
    "threats": [
      "Soap Ooze",
      "Animated Linens"
    ],
    "history": "Servants scrubbed noble linens in scalding lye.",
    "flavor": "Ghostly handprints mark wet stone.",
    "discoverables": [
      "Dusty Chest",
      "Dusty Chest"
    ],
    "tags": [
      "environment"
    ],
    "mechanics": {
      "on_clear": {
        "item": "Soap Bar"
      }
    }
  },
  {
    "id": 115,
    "name": "Candle Workshop",
    "difficulty": "Easy",
    "threats": [
      "Wax Beetle",
      "Shadow Moth"
    ],
    "history": "Candles lit every corner of the castle.",
    "flavor": "Melted wax forms strange faces on the floor.",
    "discoverables": [
      "Leather Pouch",
      "Wooden Barrel"
    ],
    "tags": [
      "environment"
    ],
    "mechanics": {
      "on_clear": {
        "gold_flat": 3
      }
    }
  },
  {
    "id": 116,
    "name": "Study Nook",
    "difficulty": "Easy",
    "threats": [
      "Dust Devil",
      "Book Mite"
    ],
    "history": "A scholar's private reading corner.",
    "flavor": "Books still open to their last-read pages.",
    "discoverables": [
      "Scholar's Desk",
      "Wooden Barrel"
    ],
    "tags": [
      "event",
      "lore"
    ],
    "mechanics": {
      "on_clear": {
        "gold_flat": 2
      }
    }
  },
  {
    "id": 117,
    "name": "Garden Storage",
    "difficulty": "Easy",
    "threats": [
      "Thorn Creeper",
      "Garden Snake"
    ],